id,instruction,context,dolly_category,tag,tag_reason
160,What does it mean if a database is ACID compliant?,"In computer science, ACID (atomicity, consistency, isolation, durability) is a set of properties of database transactions intended to guarantee data validity despite errors, power failures, and other mishaps. In the context of databases, a sequence of database operations that satisfies the ACID properties (which can be perceived as a single logical operation on the data) is called a transaction. For example, a transfer of funds from one bank account to another, even involving multiple changes such as debiting one account and crediting another, is a single transaction.

In 1983, Andreas Reuter and Theo Härder coined the acronym ACID, building on earlier work by Jim Gray who named atomicity, consistency, and durability, but not isolation, when characterizing the transaction concept. These four properties are the major guarantees of the transaction paradigm, which has influenced many aspects of development in database systems.

According to Gray and Reuter, the IBM Information Management System supported ACID transactions as early as 1973 (although the acronym was created later).

Atomicity
Main article: Atomicity (database systems)
Transactions are often composed of multiple statements. Atomicity guarantees that each transaction is treated as a single ""unit"", which either succeeds completely or fails completely: if any of the statements constituting a transaction fails to complete, the entire transaction fails and the database is left unchanged. An atomic system must guarantee atomicity in each and every situation, including power failures, errors, and crashes. A guarantee of atomicity prevents updates to the database from occurring only partially, which can cause greater problems than rejecting the whole series outright. As a consequence, the transaction cannot be observed to be in progress by another database client. At one moment in time, it has not yet happened, and at the next, it has already occurred in whole (or nothing happened if the transaction was canceled in progress).

Consistency
Main article: Consistency (database systems)
Consistency ensures that a transaction can only bring the database from one consistent state to another, preserving database invariants: any data written to the database must be valid according to all defined rules, including constraints, cascades, triggers, and any combination thereof. This prevents database corruption by an illegal transaction. Referential integrity guarantees the primary key–foreign key relationship.

Isolation
Main article: Isolation (database systems)
Transactions are often executed concurrently (e.g., multiple transactions reading and writing to a table at the same time). Isolation ensures that concurrent execution of transactions leaves the database in the same state that would have been obtained if the transactions were executed sequentially. Isolation is the main goal of concurrency control; depending on the isolation level used, the effects of an incomplete transaction might not be visible to other transactions.

Durability
Main article: Durability (database systems)
Durability guarantees that once a transaction has been committed, it will remain committed even in the case of a system failure (e.g., power outage or crash). This usually means that completed transactions (or their effects) are recorded in non-volatile memory.",,open_qa,"The question asks for an explanation of what ACID compliance means in databases, which is an open-ended knowledge-based query inviting detailed informative response."
161,"Why did a William the Conqueror, a Frenchman, become the King of England?","In the 1050s and early 1060s, William became a contender for the throne of England held by the childless Edward the Confessor, his first cousin once removed. There were other potential claimants, including the powerful English earl Harold Godwinson, whom Edward named as king on his deathbed in January 1066. Arguing that Edward had previously promised the throne to him and that Harold had sworn to support his claim, William built a large fleet and invaded England in September 1066. He decisively defeated and killed Harold at the Battle of Hastings on 14 October 1066. After further military efforts, William was crowned king on Christmas Day, 1066, in London. He made arrangements for the governance of England in early 1067 before returning to Normandy. Several unsuccessful rebellions followed, but William's hold was mostly secure on England by 1075, allowing him to spend the greater part of his reign in continental Europe.",,open_qa,问题涉及历史事件解释，答案开放多样，需综合背景分析
162,What are the health benefits of walking for exercise?,"Regular, brisk exercise of any kind can improve confidence, stamina, energy, weight control and life expectancy and reduces stress. It can also decrease the risk of coronary heart disease, strokes, diabetes, high blood pressure, bowel cancer and osteoporosis. Scientific studies have also shown that walking, besides its physical benefits, is also beneficial for the mind, improving memory skills, learning ability, concentration, mood, creativity, and abstract reasoning. Sustained walking sessions for a minimum period of thirty to sixty minutes a day, five days a week, with the correct walking posture, reduce health risks and have various overall health benefits, such as reducing the chances of cancer, type 2 diabetes, heart disease, anxiety disorder and depression. Life expectancy is also increased even for individuals suffering from obesity or high blood pressure. Walking also improves bone health, especially strengthening the hip bone, and lowering the harmful low-density lipoprotein (LDL) cholesterol, and raising the useful high-density lipoprotein (HDL) cholesterol. Studies have found that walking may also help prevent dementia and Alzheimer's.",,open_qa,问题询问健康益处，答案内容广泛且开放，涵盖多个方面
163,Summarise me a history of the Aches National Park creation,"Humans have occupied the region since the last ice age 10,000 years ago. Fremont people and Ancestral Puebloans lived in the area until about 700 years ago. Spanish missionaries encountered Ute and Paiute tribes in the area when they first came through in 1775, but the first European-Americans to attempt settlement in the area were the Mormon Elk Mountain Mission in 1855, who soon abandoned the area. Ranchers, farmers, and prospectors later settled Moab in the neighboring Riverine Valley in the late 1870s. Word of the beauty of the surrounding rock formations spread beyond the settlement as a possible tourist destination.

The Arches area was first brought to the attention of the National Park Service by Frank A. Wadleigh, passenger traffic manager of the Denver and Rio Grande Western Railroad. Wadleigh, accompanied by railroad photographer George L. Beam, visited the area in September 1923 at the invitation of Alexander Ringhoffer, a Hungarian-born prospector living in Salt Valley. Ringhoffer had written to the railroad to interest them in the tourist potential of a scenic area he had discovered the previous year with his two sons and a son-in-law, which he called the Devils Garden (known today as the Klondike Bluffs). Wadleigh was impressed by what Ringhoffer showed him, and suggested to Park Service director Stephen T. Mather that the area be made a national monument.

The following year, additional support for the monument idea came from Laurence Gould, a University of Michigan graduate student (and future polar explorer) studying the geology of the nearby La Sal Mountains, who was shown the scenic area by local physician Dr. J. W. ""Doc"" Williams.

A succession of government investigators examined the area, in part due to confusion as to the precise location. In the process, the name Devils Garden was transposed to an area on the opposite side of Salt Valley that includes Landscape Arch, the longest arch in the park. Ringhoffer's original discovery was omitted, while another area nearby, known locally as the Windows, was included. Designation of the area as a national monument was supported by the Park Service in 1926 but was resisted by President Calvin Coolidge's Interior Secretary, Hubert Work. Finally, in April 1929, shortly after his inauguration, President Herbert Hoover signed a presidential proclamation creating the Arches National Monument, consisting of two comparatively small, disconnected sections. The purpose of the reservation under the 1906 Antiquities Act was to protect the arches, spires, balanced rocks, and other sandstone formations for their scientific and educational value. The name Arches was suggested by Frank Pinkely, superintendent of the Park Service's southwestern national monuments, following a visit to the Windows section in 1925.

In late 1938, President Franklin D. Roosevelt signed a proclamation that enlarged the Arches to protect additional scenic features and permit the development of facilities to promote tourism. A small adjustment was made by President Dwight Eisenhower in 1960 to accommodate a new road alignment.

In early 1969, just before leaving office, President Lyndon B. Johnson signed a proclamation substantially enlarging the Arches. Two years later, President Richard Nixon signed legislation enacted by Congress, which significantly reduced the total area enclosed, but changed its status. Arches National Park was formally dedicated in May 1972.

In 1980, vandals attempted to use an abrasive kitchen cleanser to deface ancient petroglyphs in the park, prompting park officials to recruit physicist John F. Asmus, who specialized in using lasers to restore works of art, to use his technology to repair the damage. Asmus ""zapped the panel with intense light pulses and succeeded in removing most of the cleanser"". In 2016, there was another vandalism event on Frame Arch in the park, where a section if the rock was carved out. Due to advances in technology, in 2018 the arch was repaired through color match and modern infilling methods.",,open_qa,请求总结拱门国家公园创建的历史，属于开放式知识问答，答案需综合文本信息进行归纳
164,"Where is the ""Prairie Chicken Capital of the World""?","Cassoday is a city in Butler County, Kansas, United States. It is known as the ""Prairie Chicken Capital of the World"". As of the 2020 census, the population of the city was 113.",,closeqa,问题询问具体地点，答案可从文本直接获取
165,Please explain how a perpetrator's state of mind is relevant to guilt in committing a crime,"In jurisprudence, animus nocendi (from Latin animus 'mind', and noceo 'to harm') is the subjective state of mind of the perpetrator of a crime, with reference to the exact knowledge of illegal content of his behaviour, and of its possible consequences.

In most modern legal systems, the animus nocendi is required as an essential condition to give a penal condemnation.

The animus nocendi is usually demonstrated by the verified presence of these elements:

knowledge of a law that prohibited the discussed action or conduct (unless there exists a systemic obligation, pending on every citizen, that considers that the law has to be known by every adult — in this case the knowledge is presumed a priori; see also Ignorantia juris non excusat);
knowledge of the most likely consequences of his action;

precise intention of breaking the law or of causing the verified effects of the action.
When the author of the crime had no animus nocendi, it is usually considered that the crime still exists, but the author is innocent, unless a responsibility for guilt can be found in his conduct: the typical case of a car accident in which a wrong or even hazardous manoeuvre causes personal injuries to another car driver, is then managed as a crime for the presence of injuries, yet the author will not be prosecuted as the author of the injuries (he did not want to hurt the other driver, thus he had no animus nocendi), but simply as the author of a dangerous conduct that indirectly caused said effects, and would be held responsible at a guilt title.",,open_qa,该文本涉及法律概念的解释和分析，属于开放式知识问答
166,Please summarize how to create printable models on my 3D printer?,"3D printable models may be created with a computer-aided design (CAD) package, via a 3D scanner, or by a plain digital camera and photogrammetry software. 3D printed models created with CAD result in relatively fewer errors than other methods. Errors in 3D printable models can be identified and corrected before printing. The manual modeling process of preparing geometric data for 3D computer graphics is similar to plastic arts such as sculpting. 3D scanning is a process of collecting digital data on the shape and appearance of a real object, creating a digital model based on it.",,general_qa,询问一般性操作指南，答案基于提供文本的说明
167,What are some modern examples of companies that have harnessed the power of network effects?,"In economics, a network effect (also called network externality or demand-side economies of scale) is the phenomenon by which the value or utility a user derives from a good or service depends on the number of users of compatible products. Network effects are typically positive, resulting in a given user deriving more value from a product as more users join the same network. The adoption of a product by an additional user can be broken into two effects: an increase in the value to all other users ( ""total effect"") and also the enhancement of other non-users' motivation for using the product (""marginal effect"").

Network effects can be direct or indirect. Direct network effects arise when a given user's utility increases with the number of other users of the same product or technology, meaning that adoption of a product by different users is complementary. This effect is separate from effects related to price, such as a benefit to existing users resulting from price decreases as more users join. Direct network effects can be seen with social networking services, including Twitter, Facebook, Airbnb, Uber, and LinkedIn; telecommunications devices like the telephone; and instant messaging services such as MSN, AIM or QQ. Indirect (or cross-group) network effects arise when there are ""at least two different customer groups that are interdependent, and the utility of at least one group grows as the other group(s) grow"". For example, hardware may become more valuable to consumers with the growth of compatible software.

Network effects are commonly mistaken for economies of scale, which describe decreasing average production costs in relation to the total volume of units produced. Economies of scale are a common phenomenon in traditional industries such as manufacturing, whereas network effects are most prevalent in new economy industries, particularly information and communication technologies. Network effects are the demand side counterpart of economies of scale, as they function by increasing a customer's willingness to pay due rather than decreasing the supplier's average cost.

Upon reaching critical mass, a bandwagon effect can result. As the network continues to become more valuable with each new adopter, more people are incentivized to adopt, resulting in a positive feedback loop. Multiple equilibria and a market monopoly are two key potential outcomes in markets that exhibit network effects. Consumer expectations are key in determining which outcomes will result.",,open_qa,问题要求提供现代案例，答案开放且可多样，涉及经济学概念的解释和应用。
168,According to the passage what is the best way of making progress with mathematics?,"the famous professor Johann Bernoulli made it a special pleasure for himself to help me along in the mathematical sciences. Private lessons, however, he refused because of his busy schedule. However, he gave me a far more salutary advice, which consisted in myself getting a hold of some of the more difficult mathematical books and working through them with great diligence, and should I encounter some objections or difficulties, he offered me free access to him every Saturday afternoon, and he was gracious enough to comment on the collected difficulties, which was done with such a desired advantage that, when he resolved one of my objections, ten others at once disappeared, which certainly is the best method of making happy progress in the mathematical sciences.",,closeqa,问题询问 passage 中提到的最佳数学学习方法，答案可直接从文本中明确提取。
169,Please provide a short summary on Harshad Mehta scam.,Harshad Shantilal Mehta (29 July 1954 — 31 December 2001) was an Indian stockbroker and a convicted fraudster. Mehta's involvement in the 1992 Indian securities scam made him infamous as a market manipulator.,,open_qa,请求提供关于Harshad Mehta骗局的简要总结，属于开放式知识问答。
170,How is Praveen Babi remembered in Indian pop culture reference?,"Mahesh Bhatt, Babi's former partner, wrote and directed Arth (1982), a supposedly semi-autobiographical film about his relationship with Babi, and wrote and produced Woh Lamhe (2006) directed by his nephew Mohit Suri, based on his recollection and interpretation of his relationship with Babi and without any inputs from her.

Designer Manish Malhotra said: ""Parveen Babi brought minimalism into fashion. She was always impeccable, not overdoing it even once.""",,open_qa,问题涉及对印度流行文化中人物记忆的开放性探讨，答案具有多样性和主观性
171,What was the Ottoman ironclad Hifz-ur Rahman?,"Hifz-ur Rahman (Ottoman Turkish: Merciful Protector) was the second of two Lüft-ü Celil-class ironclads built for the Ottoman Navy in the late 1860s. Originally ordered by the Khedivate of Egypt, an autonomous vassal state of the Ottoman Empire, the central Ottoman government forced Egypt to surrender Hifz-ur Rahman while she was still under construction at the French Forges et Chantiers de la Gironde shipyard. The vessel was a turret ship, armed with two 229 mm (9 in) Armstrong guns and two 178 mm (7 in) Armstrong guns, both pairs in revolving gun turrets.

Hifz-ur Rahman saw action during the Russo-Turkish War in 1877–1878, where she operated on the Danube to try to prevent Russian forces from crossing the river. While defending the port of Sulina, she engaged Russian gunboats in an inconclusive action. She was laid up for twenty years, until the outbreak of the Greco-Turkish War in 1897, which highlighted the badly deteriorated state of the Ottoman fleet. A large-scale reconstruction program was put in place, and Hifz-ur Rahman was rebuilt in the Imperial Arsenal in the early 1890s. Nevertheless, she saw no further service of any significance, and she was sold for scrap in 1909.",,open_qa,百科型提问，介绍历史舰船背景
172,Please let me know the details of 1MDB saga and scandal.,"The 1Malaysia Development Berhad scandal, often referred to as the 1MDB scandal or just 1MDB, describes a corruption, bribery and money laundering conspiracy in which the Malaysian sovereign wealth fund 1Malaysia Development Berhad (1MDB) was systematically embezzled, with assets diverted globally by the perpetrators of the scheme. It had a global scope, implicated institutions and individuals in politics, banking, and entertainment, and sparked criminal investigations across a number of nations. The 1MDB scandal has been described as ""one of the world's greatest financial scandals"" and declared by the United States Department of Justice as the ""largest kleptocracy case to date"" in 2016.",,open_qa,请求关于1MDB事件的详细信息，属于开放式知识问答
173,"Besides his expeditions, what was Shackleton's life like?","Away from his expeditions, Shackleton's life was generally restless and unfulfilled. In his search for rapid pathways to wealth and security, he launched business ventures which failed to prosper, and he died heavily in debt. Upon his death, he was lauded in the press but was thereafter largely forgotten, while the heroic reputation of his rival Scott was sustained for many decades. Later in the 20th century, Shackleton was ""rediscovered"", and became a role model for leadership in extreme circumstances.",,open_qa,问题询问 Shackleton 除探险外的生活情况，答案内容开放且需综合理解文本信息
174,What is Protestantism and when did it start?,"Protestantism is a branch of Christianity that follows the theological tenets of the Protestant Reformation, a movement that began seeking to reform the Catholic Church from within in the 16th century against errors, abuses, and discrepancies.

Protestantism emphasizes the Christian believer's justification by God in faith alone (sola fide) rather than by a combination of faith with good works as in Catholicism; the teaching that salvation comes by divine grace or ""unmerited favor"" only (sola gratia); the priesthood of all believers in the Church; and the sola scriptura (""scripture alone"") that posits the Bible as the sole infallible source of authority for Christian faith and practice. Protestants reject the Catholic doctrine of papal supremacy, and have variant views on the number of sacraments, the real presence of Christ in the Eucharist, and matters of ecclesiastical polity and apostolic succession. Other Protestant denominations and non-denominational Protestants may be typically unconcerned about most of these theological issues and focus only on their perception of explicit Christian teachings in the Bible itself. The five solae of Lutheran and Reformed Christianity summarize basic theological differences in opposition to the Catholic Church. Today, it is the second-largest form of Christianity, with a total of 800 million to 1 billion adherents worldwide or about 37% of all Christians.",,open_qa,提问关于新教的定义和起源时间，属于开放式知识性问题，需要解释性回答
175,Please give short summary of Habiaganj Bazar railway station based on below,"Habiganj Bazar–Shaistaganj–Balla line During the colonial British rule, train services were started by rail at Habiganj Mahukuma in Sylhet district of the then (Undivided British-India) Assam province. In 1928, the British government built the Habiganj Bazar-Shaistaganj-Balla line as railway line and built infrastructure.

The railway line was opened by the Assam Bengal Railway by the then British government from Habiganj district headquarters town to Balla border via Shaistaganj junction, about 45 or 52 kilometers long railway line.

Of these, the Shaistaganj-Habiganj (15 or 16 km) railway line was inaugurated in 1928 and the Shaistaganj-Balla (30 or 36 km) railway line was inaugurated in 1929. 

Coal-engined trains used to run between eight stations at Habiganj Bazar, Habiganj Court, Shaistaganj Junction, Shakir Mohammad, Chunarughat, Amuroad, Assampara and Balla bordering Tripura.

Of these, Chunarughat, Amur road and Assampara stations were of great importance. Tea produced in 22 tea gardens from those three stations was transported by rail.

At that time, this railway was the only means of exporting tea leaves of 13 gardens of Chunarughat upazila of Habiganj at a low cost and importing related items including garden rations.

There are a total of 4 stations on the Shaistaganj-Habiganj railway line (excluding Shaistaganj Junction), namely: Habiganj Bazar, Habiganj Court, Dhuliakhal and Paikpara. The Shaistaganj-Balla railway line has a total of 7 stations (excluding Shaistaganj Junction), namely: Barkula, Shakir Muhammed, Sutang Bazar, Chunarughat, Amu Road, Assampara and Balla.

After the independence of Bangladesh, the importance of the Balla train increased further. For this reason, the railway authorities built two more stations named Sutang Bazar and Barkula, known as remote areas.

At that time, the role of the train in bringing back refugees from India was commendable. At that time, a diesel engine was added to the ballar train. The train used to travel twice a day from Habiganj to the border station Balla.

After the end of the refugee transportation phase, the smugglers took over the train in Balla. Later, the train of Balla became a train of smugglers. At first, the passengers protested about this, but later the passengers got the opportunity to travel without a ticket.

In such a situation, the running train suffered losses. The railway authorities suspended the renovation work of the railway line.",,information_extraction,任务是从给定文本中提取关于哈比甘杰集市火车站的简要总结，涉及结构化信息如历史、线路长度、车站数量及功能等。
176,"Rick was asked, Suppose your mother has four sons, named East, West, and South. What's the fourth son's name?",,,closeqa,Riddle with a single correct answer (North) based on given information.
177,Would my landlord allow me to have my dog living at the house?,,,general_qa,询问特定情境下的可行性，属于一般性咨询类问题
178,Explain how sampling bias in Voice Of Customer research could adversely affect a marketing analysis of customers' post-purchase experience with a product.,,,open_qa,问题需要解释性回答，涉及分析可能性，答案开放且可多样
179,"My back hurts when I ski a lot of moguls and bumps, why does this happen?",,,general_qa,询问日常活动相关的身体反应原因
180,Argue that large language models are not conscious.,,,general_qa,文本要求对一个命题进行论证，属于一般性问答，不涉及封闭答案、信息抽取、分类或创意写作等其他特定任务。
