id,instruction,context,dolly_category,tag,tag_reason
16,"Given a reference text about Richard Brandon Morris, tell me what when and where he was born as well as the different colleges and universities he attended.","Richard Brandon Morris (July 24, 1904 – March 3, 1989) was an American historian best known for his pioneering work in colonial American legal history and the early history of American labor. In later years, he shifted his research interests to the constitutional, diplomatic, and political history of the American Revolution and the making of the United States Constitution.

Background
Richard Brandon Morris was born on July 24, 1904, in New York City. He attended high school at Towsend Harris Hall in New York City. In 1924, he received a BA degree from City College. In 1925, he received an MA from Columbia University, and in 1930 he received a PhD in history at the university with Evarts Boutell Greene as his dissertation advisor. Morris' dissertation, published by Columbia University Press as Studies in the History of American Law, with Special Reference to the Seventeenth and Eighteenth Centuries (1930), still defines the research agenda for historians working on early American law, though at the time it attracted bitter denunciations from law school practitioners of legal historym, including Julius Goebel, Jr. and Karl Llewellyn, both then Columbia Law School faculty members.",,information_extraction,任务是从文本中提取具体的结构化信息（出生时间、地点及教育经历）
17,Why is JDAM so cost effective?,"The Joint Direct Attack Munition (JDAM) is a guidance kit that converts unguided bombs, or ""dumb bombs"", into all-weather precision-guided munitions. JDAM-equipped bombs are guided by an integrated inertial guidance system coupled to a Global Positioning System (GPS) receiver, giving them a published range of up to 15 nautical miles (28 km). JDAM-equipped bombs range from 500 to 2,000 pounds (230 to 910 kg). The JDAM's guidance system was jointly developed by the United States Air Force and United States Navy, hence the ""joint"" in JDAM. When installed on a bomb, the JDAM kit is given a GBU (Guided Bomb Unit) identifier, superseding the Mark 80 or BLU (Bomb, Live Unit) nomenclature of the bomb to which it is attached.

The JDAM is not a stand-alone weapon; rather it is a ""bolt-on"" guidance package that converts unguided gravity bombs into precision-guided munitions (PGMs). The key components of the system consist of a tail section with aerodynamic control surfaces, a (body) strake kit, and a combined inertial guidance system and GPS guidance control unit.

The JDAM was meant to improve upon laser-guided bomb and imaging infrared technology, which can be hindered by bad ground and weather conditions. Laser seekers are now being fitted to some JDAMs.",,open_qa,问题询问原因，需要基于提供的背景信息进行分析和解释
18,During which year Emperor Shapur II learned to play polo?,"The game's English name derives from the Balti language, from its word for 'ball', polo. It is cognate with the Standard Tibetan pulu, also meaning 'ball'.

Although the exact origins of the game are not certain, many scholars suggest it most likely began as a simple game played by Iranic and Turkic equestrian nomads in Central Asia. An archaic variation of polo, regionally referred to as buzkashi or kokpar, is still played in parts of Central Asia. It was developed and formalised in Ancient Iran (Persia) as ""chovgan"" (čowgān), becoming a national sport played extensively by the nobility. Women played as well as men. During the period of the Parthian Empire (247 BC to 224 AD), the sport had great patronage under the kings and noblemen. According to The Oxford Dictionary of Late Antiquity, the Persian ball game was an important pastime in the court of the Sasanian Empire (224–651). It was also part of the royal education for the Sasanian ruling class. Emperor Shapur II learnt to play polo at age seven in 316 AD.",,closeqa,问题询问具体年份，答案可直接从文本中明确获取
19,"Based on this passage, which years did the Patriots win the Super Bowl?","The Patriots hired head coach Bill Belichick, who had served as defensive coordinator under Parcells including during Super Bowl XXXI, in 2000. Their new home field, Gillette Stadium, opened in 2002 to replace the aging Foxboro Stadium. Long–time starting quarterback Drew Bledsoe, who was the franchise's star throughout the 1990s, went down with a sheared blood vessel in his chest in a week two match–up in 2001 against the rival New York Jets. Backup quarterback Tom Brady, drafted by the Patriots in sixth round of the 2000 NFL draft, became the starting quarterback. Brady's successful play led to Bledsoe never getting his job back as a starter, and would serve as the franchise's starting quarterback for the next 18 years. Under Belichick and Brady, the Patriots became one of the most consistently dominant teams in the NFL, with many describing the team as a ""dynasty"". Within the first few seasons of the 21st century, the team won three Super Bowls in four seasons (2001, 2003, and 2004), over the St. Louis Rams, Carolina Panthers, and Philadelphia Eagles, respectively. The Patriots finished the 2007 regular season with a perfect 16–0 record, becoming only the fourth team in league history to go undefeated in the regular season, and the only one since the league expanded its regular season schedule to 16 games. After advancing to Super Bowl XLII, the team's fourth Super Bowl in seven years, the Patriots were upset by the Giants to end their bid for a 19–0 season. With the loss, the Patriots ended the year at 18–1, becoming only one of three teams to go 18–1 along with the 1984 San Francisco 49ers and the 1985 Chicago Bears. However, both the Bears and 49ers lost their only game during the regular season, and both would win their respective Super Bowl.

The Patriots returned to the Super Bowl in 2011 but lost again to the Giants, 21–17. In 2014, the Patriots reached a record-tying eighth Super Bowl, where they defeated the defending champion Seattle Seahawks by a score of 28–24 to win Super Bowl XLIX for their fourth title. After Seattle had driven the ball to New England's 1-yard line with under a minute to go, New England rookie cornerback Malcolm Butler made a critical interception on Seattle's final offensive play that helped to seal the victory. New England became the first team to reach nine Super Bowls in the 2016–17 playoffs and faced the Atlanta Falcons in Super Bowl LI. Losing 28–3 midway through the third quarter, the Patriots scored 25 unanswered points to tie the game in the final seconds of regulation. In the first overtime in Super Bowl history, the Patriots won the coin toss and scored a touchdown to claim their fifth Super Bowl victory. The Patriots extended their record to ten Super Bowl appearances in the 2017–18 playoffs but lost to the Philadelphia Eagles in Super Bowl LII. The Patriots returned to the championship game for a third consecutive season in Super Bowl LIII, where they defeated the Los Angeles Rams 13–3 to win their sixth Super Bowl, tying them with the Pittsburgh Steelers for most Super Bowl victories in NFL history.",,closeqa,问题明确要求根据文本找出爱国者队赢得超级碗的具体年份，答案可直接从文中提取，属于封闭式问答。
20,What does the Obilic Medal commemorate?,"""The Obilić Medal (Serbian: Обилића медаља) or Medal for Bravery """"Miloš Obilić"""" was a medal established by Petar II Petrović-Njegoš as the highest military decoration in Montenegro, based on the cult of national hero Miloš Obilić.

The official name of the medal was the Medal for Bravery """"Miloš Obilić"""" but it was known as Obilić Medal.

It was established in 1847 and granted to soldiers for the acts of great personal courage, or for personal courage demonstrated on the battlefield, prepared for the movement for liberation and revenge of the Kosovo Battle. Another reason for introduction of this medal by Njegoš was his wish to make warfare against the Ottomans more civilized (to replace customary collection and exhibition of body parts of killed Muslim enemies).""",,closeqa,问题询问特定奖章的纪念意义，答案可从提供的文本中直接提取，具有明确性和单一性。
21,"Given this reference text about Cy Young, what type of work did his family do while he was growing up, how many older siblings did he have, and what two states did he live in as a child?","Cy Young was the oldest child born to Nancy (Mottmiller) and McKinzie Young, Jr., and was christened Denton True Young. He was of part German descent. The couple had four more children: Jesse Carlton, Alonzo, Ella, and Anthony. When the couple married, McKinzie's father gave him the 54 acres (220,000 m2) of farm land he owned. Young was born in Gilmore, a tiny farming community located in Washington Township, Tuscarawas County, Ohio. He was raised on one of the local farms and went by the name Dent Young in his early years. Young was also known as ""Farmer Young"" and ""Farmboy Young"". Young stopped his formal education after he completed the sixth grade so he could help out on the family's farm. In 1885, Young moved with his father to Nebraska, and in the summer of 1887, they returned to Gilmore.
https://en.wikipedia.org/wiki/Cy_Young",,information_extraction,从提供的文本中提取特定结构化信息（家庭工作、兄弟姐妹数量、童年居住的两个州）
22,Who is known as The Invincibles in English football?,"In football, ""The Invincibles"" is a nickname used to refer to the Preston North End team of the 1888–89 season, managed by William Sudell, and the Arsenal team of the 2003–04 season managed by Arsène Wenger.  Preston North End earned the nickname after completing an entire season undefeated in league and cup competition (27 games), while Arsenal were undefeated in the league (38 games) in a run that stretched to a record 49 games. The actual nickname of the Preston team was the ""Old Invincibles"" but both versions have been in use.",,closeqa,问题询问特定足球昵称所指的球队，答案明确且固定，可从提供的文本中直接提取。
23,"Given a reference text about Mikel Artetxe Guezuraga, tell me when he turned professional and what his biggest wins are.","Mikel Artetxe Guezuraga (born 24 September 1976) is a Spanish former road bicycle racer, who rode professionally between 1999 and 2007 for the Euskaltel–Euskadi, 3 Molinos Resort and Fuerteventura–Canarias teams.

Career
He turned professional in 1999 with Euskaltel–Euskadi, where he stayed for seven seasons. In his time with Euskaltel–Euskadi, Artetxe took two stages and the overall victory in the GP Jornal de Noticias in 2000, a stage victory in the 2001 Vuelta a Andalucía and a stage victory in the 2002 Troféu Joaquim Agostinho.

At the start of the 2006 season, Artetxe moved a division down to the newly formed 3 Molinos Resort team. Here he had the biggest wins of his career, with a stage win in the Vuelta a Asturias and the sprints classification in the Troféu Joaquim Agostinho. With the rapid demise of 3 Molinos Resort, Artetxe moved to the newly formed Fuerteventura–Canarias team for 2007.",,open_qa,"Asks for specific information from the text, but allows for open-ended retrieval of details (career turning point and major wins)."
24,What is one of Poseidon's many powers?,"The Call to Adventure
The hero begins in a situation of normality from which some information is received that acts as a call to head off into the unknown. According to Campbell, this region is represented by

a distant land, a forest, a kingdom underground, beneath the waves, or above the sky, a secret island, lofty mountaintop, or profound dream state; but it is always a place of strangely fluid and polymorphous beings, unimaginable torments, superhuman deeds, and impossible delight. The hero can go forth of their own volition to accomplish the adventure, as did Theseus when he arrived in his father's city, Athens, and heard the horrible history of the Minotaur; or they may be carried or sent abroad by some benign or malignant agent as was Odysseus, driven about the Mediterranean by the winds of the angered god, Poseidon. The adventure may begin as a mere blunder... or still, again, one may be only casually strolling when some passing phenomenon catches the wandering eye and lures one away from the frequented paths of man. Examples might be multiplied, ad infinitum, from every corner of the world.",,open_qa,问题询问波塞冬的众多能力之一，属于开放式神话知识问答，答案多样且不唯一。
25,Who won the 2000 World Series?,"The 2000 World Series was the championship series of Major League Baseball's (MLB) 2000 season. The 96th edition of the World Series, it was a best-of-seven playoff between crosstown opponents, the two-time defending World Series champions and American League (AL) champion New York Yankees and the National League (NL) champion New York Mets. The Yankees defeated the Mets, four games to one, to win their third consecutive championship and 26th overall. The series was often referred to as the ""Subway Series"", referring to the longstanding matchup between New York baseball teams; it was the first World Series contested between two New York teams since the 1956 World Series and the first since the New York Giants and the Brooklyn Dodgers moved west to California (as the current San Francisco Giants and Los Angeles Dodgers, respectively) in 1958 and the subsequent formation of the Mets in 1962. This World Series that featured teams from the same city or state, was the first of its kind since 1989 between the Oakland Athletics and the San Francisco Giants. Yankees shortstop Derek Jeter was named the World Series Most Valuable Player.",,closeqa,问题询问特定事件的明确结果，答案唯一且可从文本直接提取
26,"Classify the celebrities based on whether they were born in 1990 or 1991.
Emma Watson, Jennifer Lawrence, Ed Sheeran, Charlie Puth",,,classification,要求根据出生年份对名人进行分类
27,"Identify which instrument is string or woodwind: Balaban, Lute",,,classification,分类任务，区分乐器类型
28,"Tell me which of these characters are in Disney or Dreamworks movies: Shrek, Simba, Lightning McQueen, Po.",,,information_extraction,从文本中抽取结构化信息，判断角色所属的电影公司
29,Which is a species of fish? Sneaker or Sole,,,closeqa,问题要求从两个选项中选择一个明确答案，答案可直接确定
30,"Identify which instrument is string or percussion: Pambai, Steel Guitar",,,classification,分类任务，判断乐器属于弦乐或打击乐类别
31,"Classify the cities based on whether they are located in Wallis and Futuna or Guinea.
Mamou, Leava, Mata-Utu, Conakry, Guéckédou",,,classification,任务是对城市进行分类
32,"Classify each of the following as either a television show or a movie: The Wire, The Sopranos, Game of Thrones, Mad Men, Harry Potter, Westworld, Iron Man.",,,classification,要求对给定项目进行类别划分
33,"Tell me whether the following are foods or beverages: coffee, water, corn, tea, rice, beef.",,,classification,要求对列举的物品进行类别判断（食物或饮料）
34,"Identify which instrument is string or percussion: Kouxian, Tres cubano",,,classification,文本要求对乐器进行分类，属于类别判定任务。
35,Is the sun a star or a planet?,,,closeqa,问题有明确的单一答案，可通过科学知识直接判断
36,"Which of these is not like the other?  Baseball, basketball, rock, puck,",,,classification,要求判断哪个选项与其他不同类，属于类别区分任务
37,"I am looking at items on my desk right now, tell me which ones are actually considered office accessories.",,,general_qa,"Asking for identification of office accessories from items on the desk, which is a general knowledge question related to categorization but not strictly involving structured extraction, open-ended answers, or creative writing."
38,"Identify which instrument is string or percussion: Caxixi, Gunjac",,,classification,任务是对乐器进行分类
39,"Tell me whether these cities are in Italy or Switzerland: Milan, Florence, Zurich, Bern, Lucerne, Rome",,,classification,Assigning categories (country) to listed cities
40,"Classify each of the following into either a solid, liquid or gas: blood, xenon, gold, wood, neon, brick, milk, xenon, coffee, gases, helium",,,classification,"Assigning items to predefined categories (solid, liquid, gas)"
41,"Which is a bird or fish: Black grouse, Blackfish",,,classification,要求对给定名称进行类别区分
42,Which is a species of fish? Black Mamba or Black Sea Bass,,,closeqa,问题要求从两个选项中选择一个明确答案，属于封闭式知识问答
43,"Identify which instrument is string or percussion: Cowbell, Crwth",,,classification,要求对乐器进行类别划分
44,"Which of the following bodies of water are below sea level: Dead Sea, Lake Ontario, Sea of Galilee, the Hudson Bay, Lake Assal?",,,closeqa,问题要求从给定选项中准确选出低于海平面的水体，答案唯一且可通过地理知识直接判断。
45,"Classify each of the following as either characters from books by Anne Rice or Stephanie Meyer: Lestat de Lioncourt, Memnoch, Lasher, Armand, Yvette, Bella Swan, Edward Cullen, Jacob Black, Melanie Stryder, The Seeker",,,classification,任务是对给定名单中的角色进行归属分类，判断其出自哪位作家的作品，属于文本类别判定任务。
46,"When being in cold weather, categorize each of the following as ""Useful"" or ""Not Useful"": Coat, Air Condition, Ice, Beanie, Pants, Bikini",,,classification,文本要求对物品在寒冷天气中的用途进行分类
47,"Choose the word which is different from the rest:  Trigger, Muzzle, Pallete, Barrel, Bullet",,,classification,任务是判断哪个词与其他词不同，属于分类判断
48,Which is a species of fish? Plaice or Place,,,closeqa,问题询问特定知识，答案唯一确定
49,What is genomics?,,,open_qa,百科型提问，答案开放可多样
50,Which is a species of fish? Panga or Pangea,,,closeqa,问题要求从两个选项中选择一个明确的答案，且答案可通过事实知识直接验证。
51,Who was Loku Nilame Adikaram Ratwatte,,,open_qa,提问涉及历史人物身份，需开放性知识回答
52,Why does oil float on water?,,,open_qa,提问涉及科学原理，需解释现象，答案具有开放性和知识性
53,What are the three main nutrient groups?,,,open_qa,百科型提问，答案开放可多样
54,"What is ""diglossia""?",,,open_qa,提问关于术语定义，属于开放式知识问答
55,What is a dataset?,,,open_qa,提问关于概念定义，答案开放且需知识性解释
56,Who was Bran the Builder?,,,open_qa,提问涉及《冰与火之歌》中的人物背景，属于开放式知识问答
57,Which Targaryen conquered Westeros?,,,closeqa,问题询问特定历史事件的明确答案，有单一正确答案
58,Which artist made the hit song One More Time?,,,closeqa,问题询问特定信息，答案明确且唯一
59,Which parts do people train on the upper body?,,,open_qa,提问关于人体训练部位，属于开放式知识问答
60,Is the Tiger population Increasing in India?,,,closeqa,明确的封闭式问题，需具体数据或 fact-based 回答
61,What is the difference between archaeology and paleontology?,,,open_qa,开放式知识问答 comparing two fields
62,What is POP3 protocol?,,,open_qa,询问协议定义，属开放式知识问答
63,Who wrote The Picture of Dorian Grey in 1891,,,closeqa,问题询问具体作者信息，答案唯一且可从知识库直接获取。
64,What is the main language spoken in South America?,,,closeqa,询问单一明确答案的事实性问题
65,What is the name of the professional football team in Colorado?,,,closeqa,"Asks for a specific, factual answer with a single correct response."
66,What is an adjective?,,,closeqa,Definition of a grammatical term
67,Who was Calvin Parker MacDonald,,,open_qa,提问涉及人物背景信息，需百科或开放知识回答
68,How can I make the paint color purple from primary colors?,,,open_qa,问题询问如何通过混合原色得到紫色，属于开放式知识问答
69,What is the difference between the Debt Snowball and Debt Avalanche methods of paying off debt?,,,open_qa,提问涉及两种债务偿还方法的比较，属于开放式知识问答
70,Who wrote the second episode of season four of Game of Thrones?,,,closeqa,问题询问具体信息，答案单一明确
71,What are the official languages of Canada?,,,closeqa,问题询问加拿大的官方语言，答案明确且固定（英语和法语），属于封闭式问答。
72,What is a surf board used for?,,,closeqa,问题询问具体物品的用途，答案明确且单一。
73,At what temperature does water boil?,,,closeqa,问水沸腾的具体温度，答案明确单一
74,Air Lingus is the national airline of which country,,,closeqa,问题询问特定事实，答案明确且唯一
75,What country was Frida Kahlo from and what career was she famous for?,,,closeqa,问题询问明确事实，答案可从已知信息中直接获取
76,From the passage list down the various models of Tesla vehicle. List the results in comma separated format.,"Tesla, Inc. (/ˈtɛslə/ TESS-lə or /ˈtɛzlə/ TEZ-lə) is an American multinational automotive and clean energy company headquartered in Austin, Texas, United States. Tesla designs and manufactures electric vehicles (electric cars and trucks), battery energy storage from home to grid-scale, solar panels and solar roof tiles, and related products and services. Tesla is one of the world's most valuable companies and is, as of 2023, the world's most valuable automaker. In 2021, the company had the most worldwide sales of battery electric vehicles and plug-in electric vehicles, capturing 21% of the battery-electric (purely electric) market and 14% of the plug-in market (which includes plug-in hybrids). Through its subsidiary Tesla Energy, the company develops and is a major installer of photovoltaic systems in the United States. Tesla Energy is also one of the largest global suppliers of battery energy storage systems, with 3.99 gigawatt-hours (GWh) installed in 2021.

Tesla was incorporated in July 2003 by Martin Eberhard and Marc Tarpenning as Tesla Motors. The company's name is a tribute to inventor and electrical engineer Nikola Tesla. In February 2004, via a $6.5 million investment, Elon Musk became the largest shareholder of the company. He has served as CEO since 2008. According to Musk, the purpose of Tesla is to help expedite the move to sustainable transport and energy, obtained through electric vehicles and solar power. Tesla began production of its first car model, the Roadster sports car, in 2008. This was followed by the Model S sedan in 2012, the Model X SUV in 2015, the Model 3 sedan in 2017, the Model Y crossover in 2020, and the Tesla Semi truck in 2022. The company plans to start production of the Cybertruck light-duty pickup truck in 2023. The Model 3 is the all-time bestselling plug-in electric car worldwide, and, in June 2021, became the first electric car to sell 1 million units globally. Tesla's 2022 full year deliveries were around 1.31 million vehicles, a 40% increase over the previous year, and cumulative sales totaled 3 million cars as of August 2022. In October 2021, Tesla's market capitalization reached $1 trillion, the sixth company to do so in U.S. history.

Tesla has been the subject of several lawsuits, government scrutiny, journalistic criticism, and public controversies arising from statements and acts of CEO Elon Musk and from allegations of whistleblower retaliation, worker rights violations, and defects with their products.",,information_extraction,The task requires extracting specific structured information (Tesla vehicle models) from the provided text.
77,Who is Enrique Jorrín?,"The creation of cha-cha-chá has been traditionally attributed to Cuban composer and violinist Enrique Jorrín, who began his career playing for the charanga band Orquesta América. According to the testimony of Enrique Jorrín, he composed some danzones in which musicians of the orchestra had to sing short refrains, and this style was very successful. In the danzón ""Constancia"", he introduced some montunos and the audience was motivated to join in singing the refrains. Jorrín also asked the members of the orchestra to sing in unison so the lyrics might be heard more clearly and achieve a greater impact in the audience. That way of singing also helped to mask the poor singing skills of the orchestra members.",,closeqa,问题询问特定人物的身份，答案可以从提供的文本中直接提取。
78,What is Indian Premier League?,"The Indian Premier League (IPL) (also known as the TATA IPL for sponsorship reasons) is a men's Twenty20 (T20) cricket league held annually in India and contested by ten city-based franchise teams. The league was founded by the Board of Control for Cricket in India (BCCI) in 2007. Brijesh Patel is the incumbent chairman of the IPL. The competition is usually held annually in summer (between March and May) and has an exclusive window in the ICC Future Tours Programme, meaning that less international cricket take place during the IPL seasons.",,open_qa,提问关于印度超级联赛的定义和背景，答案内容开放且涉及百科知识
